{
  "id": "frosting-grassland-standard",
  "name": "糖霜草地标准波次",
  "version": 31,
  "map_id": "frosting-grassland",
  "duration_seconds": 600,
  "segments": [
    {
      "start_second": 0,
      "end_second": 90,
      "spawn_interval_ms": 1250,
      "spawn_count": 1,
      "max_alive": 35,
      "enemy_pool": [
        {
          "enemy_id": "bouncy-gummy",
          "weight": 1
        }
      ]
    },
    {
      "start_second": 90,
      "end_second": 210,
      "spawn_interval_ms": 950,
      "spawn_count": 2,
      "max_alive": 55,
      "enemy_pool": [
        {
          "enemy_id": "bouncy-gummy",
          "weight": 0.58
        },
        {
          "enemy_id": "sour-gummy",
          "weight": 0.18
        },
        {
          "enemy_id": "sticky-bear-gummy",
          "weight": 0.1
        },
        {
          "enemy_id": "licorice-skipper",
          "weight": 0.08
        },
        {
          "enemy_id": "sugar-moth",
          "weight": 0.06
        }
      ]
    },
    {
      "start_second": 210,
      "end_second": 225,
      "spawn_interval_ms": 950,
      "spawn_count": 2,
      "max_alive": 72,
      "enemy_pool": [
        {
          "enemy_id": "bouncy-gummy",
          "weight": 0.19
        },
        {
          "enemy_id": "sour-gummy",
          "weight": 0.18
        },
        {
          "enemy_id": "sandwich-cookie-creep",
          "weight": 0.14
        },
        {
          "enemy_id": "sticky-bear-gummy",
          "weight": 0.1
        },
        {
          "enemy_id": "soda-bubble",
          "weight": 0.07
        },
        {
          "enemy_id": "licorice-skipper",
          "weight": 0.14
        },
        {
          "enemy_id": "sugar-moth",
          "weight": 0.1
        },
        {
          "enemy_id": "sprinkle-spitter",
          "weight": 0.08
        }
      ]
    },
    {
      "start_second": 225,
      "end_second": 255,
      "spawn_interval_ms": 930,
      "spawn_count": 2,
      "max_alive": 74,
      "enemy_pool": [
        {
          "enemy_id": "bouncy-gummy",
          "weight": 0.25
        },
        {
          "enemy_id": "sour-gummy",
          "weight": 0.13
        },
        {
          "enemy_id": "sandwich-cookie-creep",
          "weight": 0.15
        },
        {
          "enemy_id": "sticky-bear-gummy",
          "weight": 0.1
        },
        {
          "enemy_id": "soda-bubble",
          "weight": 0.07
        },
        {
          "enemy_id": "licorice-skipper",
          "weight": 0.13
        },
        {
          "enemy_id": "sugar-moth",
          "weight": 0.08
        },
        {
          "enemy_id": "sprinkle-spitter",
          "weight": 0.09
        }
      ]
    },
    {
      "start_second": 255,
      "end_second": 270,
      "spawn_interval_ms": 900,
      "spawn_count": 2,
      "max_alive": 76,
      "enemy_pool": [
        {
          "enemy_id": "bouncy-gummy",
          "weight": 0.22
        },
        {
          "enemy_id": "sour-gummy",
          "weight": 0.12
        },
        {
          "enemy_id": "sandwich-cookie-creep",
          "weight": 0.14
        },
        {
          "enemy_id": "sticky-bear-gummy",
          "weight": 0.09
        },
        {
          "enemy_id": "soda-bubble",
          "weight": 0.07
        },
        {
          "enemy_id": "licorice-skipper",
          "weight": 0.15
        },
        {
          "enemy_id": "sugar-moth",
          "weight": 0.1
        },
        {
          "enemy_id": "sprinkle-spitter",
          "weight": 0.11
        }
      ]
    },
    {
      "start_second": 270,
      "end_second": 300,
      "spawn_interval_ms": 860,
      "spawn_count": 2,
      "max_alive": 80,
      "enemy_pool": [
        {
          "enemy_id": "bouncy-gummy",
          "weight": 0.18
        },
        {
          "enemy_id": "sour-gummy",
          "weight": 0.1
        },
        {
          "enemy_id": "sandwich-cookie-creep",
          "weight": 0.13
        },
        {
          "enemy_id": "sticky-bear-gummy",
          "weight": 0.08
        },
        {
          "enemy_id": "soda-bubble",
          "weight": 0.06
        },
        {
          "enemy_id": "licorice-skipper",
          "weight": 0.15
        },
        {
          "enemy_id": "sugar-moth",
          "weight": 0.1
        },
        {
          "enemy_id": "sprinkle-spitter",
          "weight": 0.11
        },
        {
          "enemy_id": "spicy-gummy",
          "weight": 0.09
        }
      ]
    },
    {
      "start_second": 300,
      "end_second": 480,
      "spawn_interval_ms": 820,
      "spawn_count": 3,
      "max_alive": 82,
      "enemy_pool": [
        {
          "enemy_id": "bouncy-gummy",
          "weight": 0.25
        },
        {
          "enemy_id": "sour-gummy",
          "weight": 0.14
        },
        {
          "enemy_id": "sandwich-cookie-creep",
          "weight": 0.13
        },
        {
          "enemy_id": "caramel-slime",
          "weight": 0.08
        },
        {
          "enemy_id": "sticky-bear-gummy",
          "weight": 0.08
        },
        {
          "enemy_id": "soda-bubble",
          "weight": 0.07
        },
        {
          "enemy_id": "cotton-candy-clump",
          "weight": 0.05
        },
        {
          "enemy_id": "licorice-skipper",
          "weight": 0.1
        },
        {
          "enemy_id": "sugar-moth",
          "weight": 0.06
        },
        {
          "enemy_id": "taffy-shieldling",
          "weight": 0.04
        }
      ]
    },
    {
      "start_second": 480,
      "end_second": 600,
      "spawn_interval_ms": 700,
      "spawn_count": 3,
      "max_alive": 105,
      "enemy_pool": [
        {
          "enemy_id": "bouncy-gummy",
          "weight": 0.18
        },
        {
          "enemy_id": "sour-gummy",
          "weight": 0.12
        },
        {
          "enemy_id": "sandwich-cookie-creep",
          "weight": 0.14
        },
        {
          "enemy_id": "caramel-slime",
          "weight": 0.09
        },
        {
          "enemy_id": "sticky-bear-gummy",
          "weight": 0.07
        },
        {
          "enemy_id": "soda-bubble",
          "weight": 0.06
        },
        {
          "enemy_id": "licorice-skipper",
          "weight": 0.12
        },
        {
          "enemy_id": "sugar-moth",
          "weight": 0.1
        },
        {
          "enemy_id": "taffy-shieldling",
          "weight": 0.08
        },
        {
          "enemy_id": "sprinkle-spitter",
          "weight": 0.04
        }
      ]
    }
  ],
  "boss_events": [
    {
      "time_second": 210,
      "boss_id": "runaway-sugar-mixer"
    }
  ],
  "pressure_budget": {
    "early": "low",
    "middle": "medium",
    "late": "high"
  }
}
